{
  "schema_version": "1.0.0",
  "catalog_id": "sim01-catalog-v1",
  "engine_semantics_version": "sim-core-0.1",
  "source_manifest_id": "legacy-champions-59bf57c-sim01",
  "type_chart_default_multiplier": 1,
  "types": [
    {"type_id": "normal", "legacy_type_id": 0, "name": "ノーマル"},
    {"type_id": "flying", "legacy_type_id": 2, "name": "ひこう"},
    {"type_id": "poison", "legacy_type_id": 3, "name": "どく"},
    {"type_id": "ground", "legacy_type_id": 4, "name": "じめん"},
    {"type_id": "bug", "legacy_type_id": 6, "name": "むし"},
    {"type_id": "steel", "legacy_type_id": 8, "name": "はがね"},
    {"type_id": "fire", "legacy_type_id": 9, "name": "ほのお"},
    {"type_id": "water", "legacy_type_id": 10, "name": "みず"},
    {"type_id": "grass", "legacy_type_id": 11, "name": "くさ"},
    {"type_id": "electric", "legacy_type_id": 12, "name": "でんき"},
    {"type_id": "psychic", "legacy_type_id": 13, "name": "エスパー"},
    {"type_id": "ice", "legacy_type_id": 14, "name": "こおり"},
    {"type_id": "dragon", "legacy_type_id": 15, "name": "ドラゴン"}
  ],
  "type_chart": {
    "normal": {"steel": 0.5},
    "flying": {"grass": 2.0, "bug": 2.0, "electric": 0.5, "steel": 0.5},
    "poison": {"grass": 2.0, "poison": 0.5, "ground": 0.5, "steel": 0.0},
    "ground": {"poison": 2.0, "fire": 2.0, "electric": 2.0, "steel": 2.0, "grass": 0.5, "bug": 0.5, "flying": 0.0},
    "bug": {"grass": 2.0, "psychic": 2.0, "poison": 0.5, "flying": 0.5, "fire": 0.5, "steel": 0.5},
    "steel": {"ice": 2.0, "fire": 0.5, "water": 0.5, "electric": 0.5, "steel": 0.5},
    "fire": {"grass": 2.0, "ice": 2.0, "bug": 2.0, "steel": 2.0, "fire": 0.5, "water": 0.5, "dragon": 0.5},
    "water": {"fire": 2.0, "ground": 2.0, "water": 0.5, "grass": 0.5, "dragon": 0.5},
    "grass": {"water": 2.0, "ground": 2.0, "fire": 0.5, "grass": 0.5, "poison": 0.5, "flying": 0.5, "bug": 0.5, "dragon": 0.5, "steel": 0.5},
    "electric": {"water": 2.0, "flying": 2.0, "electric": 0.5, "grass": 0.5, "dragon": 0.5, "ground": 0.0},
    "psychic": {"poison": 2.0, "psychic": 0.5, "steel": 0.5},
    "ice": {"grass": 2.0, "ground": 2.0, "flying": 2.0, "dragon": 2.0, "fire": 0.5, "water": 0.5, "ice": 0.5, "steel": 0.5},
    "dragon": {"dragon": 2.0, "steel": 0.5}
  },
  "abilities": [
    {"ability_id": "rough_skin", "legacy_ability_id": 24, "name": "さめはだ", "effect_id": "rough_skin"},
    {"ability_id": "natural_cure", "legacy_ability_id": 30, "name": "しぜんかいふく", "effect_id": "natural_cure"},
    {"ability_id": "technician", "legacy_ability_id": 101, "name": "テクニシャン", "effect_id": "technician"},
    {"ability_id": "intimidate", "legacy_ability_id": 22, "name": "いかく", "effect_id": "intimidate"},
    {"ability_id": "overgrow", "legacy_ability_id": 65, "name": "しんりょく", "effect_id": "overgrow"},
    {"ability_id": "blaze", "legacy_ability_id": 66, "name": "もうか", "effect_id": "blaze"}
  ],
  "items": [
    {"item_id": "leftovers", "legacy_item_id": 234, "name": "たべのこし", "effect_id": "leftovers"},
    {"item_id": "sitrus_berry", "legacy_item_id": 158, "name": "オボンのみ", "effect_id": "sitrus_berry", "consumable": true},
    {"item_id": "focus_sash", "legacy_item_id": 275, "name": "きあいのタスキ", "effect_id": "focus_sash", "consumable": true}
  ],
  "moves": [
    {"move_id": "earthquake", "legacy_move_id": 89, "name": "じしん", "type_id": "ground", "category": "physical", "power": 100, "accuracy": 100, "pp": 12, "priority": 0, "contact": false, "effect": {"kind": "damage"}},
    {"move_id": "dragon_claw", "legacy_move_id": 337, "name": "ドラゴンクロー", "type_id": "dragon", "category": "physical", "power": 80, "accuracy": 100, "pp": 16, "priority": 0, "contact": true, "effect": {"kind": "damage"}},
    {"move_id": "swords_dance", "legacy_move_id": 14, "name": "つるぎのまい", "type_id": "normal", "category": "status", "power": null, "accuracy": null, "pp": 20, "priority": 0, "contact": false, "effect": {"kind": "raise_self", "stages": {"atk": 2}}},
    {"move_id": "flamethrower", "legacy_move_id": 53, "name": "かえんほうしゃ", "type_id": "fire", "category": "special", "power": 90, "accuracy": 100, "pp": 16, "priority": 0, "contact": false, "effect": {"kind": "damage_secondary_status", "status": "burn", "chance_numerator": 1, "chance_denominator": 10}},
    {"move_id": "surf", "legacy_move_id": 57, "name": "なみのり", "type_id": "water", "category": "special", "power": 90, "accuracy": 100, "pp": 16, "priority": 0, "contact": false, "effect": {"kind": "damage"}},
    {"move_id": "psychic", "legacy_move_id": 94, "name": "サイコキネシス", "type_id": "psychic", "category": "special", "power": 90, "accuracy": 100, "pp": 12, "priority": 0, "contact": false, "effect": {"kind": "damage_secondary_stage", "target": "opponent", "stages": {"spd": -1}, "chance_numerator": 1, "chance_denominator": 10}},
    {"move_id": "hydro_pump", "legacy_move_id": 56, "name": "ハイドロポンプ", "type_id": "water", "category": "special", "power": 110, "accuracy": 80, "pp": 8, "priority": 0, "contact": false, "effect": {"kind": "damage"}},
    {"move_id": "recover", "legacy_move_id": 105, "name": "じこさいせい", "type_id": "normal", "category": "status", "power": null, "accuracy": null, "pp": 8, "priority": 0, "contact": false, "effect": {"kind": "heal_self", "numerator": 1, "denominator": 2}},
    {"move_id": "bullet_punch", "legacy_move_id": 418, "name": "バレットパンチ", "type_id": "steel", "category": "physical", "power": 40, "accuracy": 100, "pp": 20, "priority": 1, "contact": true, "effect": {"kind": "damage"}},
    {"move_id": "aerial_ace", "legacy_move_id": 332, "name": "つばめがえし", "type_id": "flying", "category": "physical", "power": 60, "accuracy": null, "pp": 20, "priority": 0, "contact": true, "effect": {"kind": "damage"}},
    {"move_id": "x_scissor", "legacy_move_id": 404, "name": "シザークロス", "type_id": "bug", "category": "physical", "power": 80, "accuracy": 100, "pp": 16, "priority": 0, "contact": true, "effect": {"kind": "damage"}},
    {"move_id": "waterfall", "legacy_move_id": 127, "name": "たきのぼり", "type_id": "water", "category": "physical", "power": 80, "accuracy": 100, "pp": 16, "priority": 0, "contact": true, "effect": {"kind": "damage_secondary_flinch", "chance_numerator": 1, "chance_denominator": 5}},
    {"move_id": "aqua_tail", "legacy_move_id": 401, "name": "アクアテール", "type_id": "water", "category": "physical", "power": 90, "accuracy": 90, "pp": 12, "priority": 0, "contact": true, "effect": {"kind": "damage"}},
    {"move_id": "dragon_dance", "legacy_move_id": 349, "name": "りゅうのまい", "type_id": "dragon", "category": "status", "power": null, "accuracy": null, "pp": 20, "priority": 0, "contact": false, "effect": {"kind": "raise_self", "stages": {"atk": 1, "spe": 1}}},
    {"move_id": "sludge_bomb", "legacy_move_id": 188, "name": "ヘドロばくだん", "type_id": "poison", "category": "special", "power": 90, "accuracy": 100, "pp": 12, "priority": 0, "contact": false, "effect": {"kind": "damage_secondary_status", "status": "poison", "chance_numerator": 3, "chance_denominator": 10}},
    {"move_id": "giga_drain", "legacy_move_id": 202, "name": "ギガドレイン", "type_id": "grass", "category": "special", "power": 75, "accuracy": 100, "pp": 12, "priority": 0, "contact": false, "effect": {"kind": "damage_drain", "numerator": 1, "denominator": 2}},
    {"move_id": "growth", "legacy_move_id": 74, "name": "せいちょう", "type_id": "grass", "category": "status", "power": null, "accuracy": null, "pp": 20, "priority": 0, "contact": false, "effect": {"kind": "raise_self", "stages": {"atk": 1, "spa": 1}}},
    {"move_id": "energy_ball", "legacy_move_id": 412, "name": "エナジーボール", "type_id": "grass", "category": "special", "power": 90, "accuracy": 100, "pp": 12, "priority": 0, "contact": false, "effect": {"kind": "damage_secondary_stage", "target": "opponent", "stages": {"spd": -1}, "chance_numerator": 1, "chance_denominator": 10}},
    {"move_id": "air_slash", "legacy_move_id": 403, "name": "エアスラッシュ", "type_id": "flying", "category": "special", "power": 75, "accuracy": 95, "pp": 16, "priority": 0, "contact": false, "effect": {"kind": "damage_secondary_flinch", "chance_numerator": 3, "chance_denominator": 10}},
    {"move_id": "will_o_wisp", "legacy_move_id": 261, "name": "おにび", "type_id": "fire", "category": "status", "power": null, "accuracy": 85, "pp": 16, "priority": 0, "contact": false, "effect": {"kind": "inflict_status", "status": "burn"}},
    {"move_id": "dragon_pulse", "legacy_move_id": 406, "name": "りゅうのはどう", "type_id": "dragon", "category": "special", "power": 85, "accuracy": 100, "pp": 12, "priority": 0, "contact": false, "effect": {"kind": "damage"}}
  ],
  "species": [
    {"pokemon_id": "garchomp", "legacy_pokemon_id": "n445", "name": "ガブリアス", "types": ["dragon", "ground"], "ability_ids": ["rough_skin"], "legal_move_ids": ["earthquake", "dragon_claw", "swords_dance", "flamethrower"]},
    {"pokemon_id": "starmie", "legacy_pokemon_id": "n121", "name": "スターミー", "types": ["water", "psychic"], "ability_ids": ["natural_cure"], "legal_move_ids": ["surf", "psychic", "hydro_pump", "recover"]},
    {"pokemon_id": "scizor", "legacy_pokemon_id": "n212", "name": "ハッサム", "types": ["bug", "steel"], "ability_ids": ["technician"], "legal_move_ids": ["bullet_punch", "aerial_ace", "swords_dance", "x_scissor"]},
    {"pokemon_id": "gyarados", "legacy_pokemon_id": "n130", "name": "ギャラドス", "types": ["water", "flying"], "ability_ids": ["intimidate"], "legal_move_ids": ["waterfall", "aqua_tail", "dragon_dance", "earthquake"]},
    {"pokemon_id": "venusaur", "legacy_pokemon_id": "n3", "name": "フシギバナ", "types": ["grass", "poison"], "ability_ids": ["overgrow"], "legal_move_ids": ["sludge_bomb", "giga_drain", "growth", "energy_ball"]},
    {"pokemon_id": "charizard", "legacy_pokemon_id": "n6", "name": "リザードン", "types": ["fire", "flying"], "ability_ids": ["blaze"], "legal_move_ids": ["flamethrower", "air_slash", "will_o_wisp", "dragon_pulse"]}
  ]
}
